Sentence,jfr,jannik,MaxK,student1,student2,arjen
"In CASN, the node’s context is most important than the human context.",,,,1,,
The context interpretation is achieved by using an interpreter based on fuzzy rules called CIBFR (Context Interpreter Based on Fuzzy Rule).,,,,1,,
"By matchmaking, CASDA discovers services, which match with given service request.",,,,1,,
"Otherwise, weak WSN devices enable higher deployment densities and increase network lifetime as they are cheaper and consume less power.",,,,1,,
"By integrating devices with different resources and capabilities, a heterogeneous WSN can combine the advantages of both powerful and weak devices.",,,,1,,
New programming models are necessary to simplify WSN application development and increase overall network utility.,,,,1,,
"These services are dynamically discovered and used at run-time, enabling applications to be platform-independent and adapt to network dynamics.",,,,1,,
"While service-oriented computing is widely used on the Internet, adopting it to WSNs is non-trivial due to the extremely limited resources available and highly dynamic nature.",,,,1,,
"Therefore, service provisioning in Sensor Networks is a huge challenge.",,,,1,,
The classical SOA-based approaches are not currently feasible to be used over Wireless Sensor Networks because of the intrinsic resource limitations of that kind of technologies.,,,,1,,
"The SOA standards such as XML, HTTP, SOAP, WSDL and UDDI are majorly related with web services provisioning by using no resources-constrained computers so they are not recommended to be applied in WSN.",,,,1,,
The authors of [42] chose this methodology since the WSN development is iterative and short what suits with the agile methods.,,,,1,,
"For filtering purpose, only those services that belong to service requester category are managed.",,,,1,,
"To perform the comparison between requested and available service some factors are taken into account such service’s inputs and outputs, and required contextual information.",,,,1,,
"Services are able to maintain state, provide multiple methods, and have their own thread of control, enabling them to operate in parallel with task.",,,,1,,
"The first, ServillaSpec, is used to create service specifications and descriptions that enable flexible matching between tasks and services.",,,,1,,
"Wireless sensors networks, as the field of matures, needs support more complex applications and collaboration among them in order to provide services.",,,,1,,
"For this propose, it’s necessary more powerful programming methods, monitoring and control, both hardware and software, during its operation.",,,,1,,
"Therefore, it’s necessary to develop an environment that configures each application and the relation with the others applications that provide the service.",,,,1,,
"Due these limitations, main efforts in management procedures for sensor networks are mainly focused on monitoring and controlling tasks, in order to optimize the network operation and maintain the network performance [52].",,,,1,,
"RRP (Register mechanism Routing Protocol) [55] is a cluster-based mobile routing algorithm aimed to improve the network life-time, using for this a system’s load balancing schema, which defines a set of flooding-zones for the data forwarding decisions, in order to perform the data aggregation tasks.",,,,1,,
"The main advantages of RRP are that zone flooding ensures low message overheads, and adjusting the size of flooding zone, it ensures high reliability.",,,,1,,
"The main lacks of RRP are that it requires a GPS device attached to the sensor nodes, in order to implement the zone-flooding protocol.",,,,1,,
"To achieve the previous exposed goals, SNMS develops a gathering tree to collect network health information, introducing a minimal impact on memory and network traffic.",,,,1,,
SNMS further minimizes energy consumption merging multiple queries into a single message.,,,,1,,
"On the other hand, SNMS network management function is limited to passive monitoring only, requiring human managers to submit queries and perform post-mortem analysis of management data.",,,,1,,
"On the other hand, BOSS requires human interaction to analyze the network states, taking management actions accordingly.",,,,1,,
To interconnect different SSNs is proposed the use of gateways.,,,,1,,
The benefit of using such architectures is the deployment and maintenance facility induced by the inherent plug-and-play and self-organized nature of wireless sensor networks.,,,,1,,
"Event-centric wireless sensor networks (EC-WSNs) differ from common WSNs, where the communications are triggered either by an on-demand or a sink-based process.",,,,1,,
"Indeed, in this case, the communication is triggered only when an event is detected in the immediate sensing-range of a node.",,,,1,,
"A wireless sensor network is vulnerable due to its characteristics as an open medium, with a network topology that dynamically changes, which employs cooperative algorithms, it lacks an element for managing and monitoring the network and it also hasn’t a perimeter defence [66][68][70] clearly defined.",,,,1,,
"The security problems in a wireless sensor networks become clear with the assumption that radio links are insecure, which makes communication in wireless sensor networks insecure too.",,,,1,,
"Attacks from malicious motes that are not part of the network and try to join it without authorization, are often done applying cryptanalysis techniques and attacking physically the device.",,,,1,,
Motes are part of the network and they may attack if they have been compromised by an attacker that has manipulated them [66].,,,,1,,
"RC5 (Rivest Cipher-5) is an encryption block algorithm [73], which may be one of the cryptographic algorithms more suitable for WSN due to their good behavior in devices with low memory capacity.",,,,1,,
"Thus also studies made by our researchers [78], has been shown that the use of the AES algorithm reduces half the batteries life.",,,,,1,
The traditional DES (Data Encryption Standard) uses many computational resources and therefore it isn’t recommended [79] for use in WSN.,,,,,1,
"One of the greatest advantages is that the primitives are already included a specific operating system for wireless sensor networks, allowing developers use this type of primitive easily.",,,,,1,
TinyECC and WMECC perform for the first time deployments based in public key cryptography and introduce the concept of digital signature in devices designed for use on WSN.,,,,,1,
"However, the main disadvantage of this type of cryptography, is the high run time (with temporary magnitude scales around a second) required for data encryption or for processing or verifying digital signatures.",,,,,1,
"Although cannot speak about a security model, .NET Micro Framework provides the necessary tools to create a complete security model.",,,,,1,
"In the case of public communications networks, specific legal, regulatory and technical provisions should be made in order to protect fundamental rights and freedoms of natural person.",,,,,1,
"Measures should be taken to prevent unauthorized access to communications in order to protect the confidentiality of communications, including both the contents and any data related to such communications, by means of public communications networks and public available electronic services.",,,,,1,
"In digital mobile networks, location data giving the geographic position of the terminal equipment of the mobile user are processed to enable the transmission of communications.",,,,,1,
"On 25 June 2008, the European Parliament's Standing Committee on Civil Liberties, Justice and Home Affairs asked for measures to correct the European Commission's proposal to amend the Directive on Privacy and Electronic Communications (called ePrivacy Directive).",,,,,0,
The EDPS basically supported the EC proposal giving a few recommendations such as the obligation to notify any breach of security not only from providers of public electronic communication services in public networks but also from providers of information society services which process sensitive personal data.,,,,,0,
"When the number of nodes in the WSN grows and new services more complex are implemented, it is necessary to include authentication and authorization services in order to verify the data source and to allow taking authorization decisions.",,,,,1,
"In a model of communication between two parties, the data authentication can use symmetric mechanisms.",,,,,0,
Sender and receiver share a secret key to generate and verify a MAC (Message Authentication Code) [72].,,,,,0,
MAC mechanisms can be integrated into a sensor network through the protocol family SPINS (Security Protocols in Networked Systems ) [84].,,,,,1,
"The uTesla protocol solves this problem by introducing asymmetry through the delayed revelation of symmetric keys, allowing an efficient authentication broadcast scheme.",,,,,1,
However [85] explains that uTelsa is not suitable for the authentication traffic between nodes because it provides authentication delayed in time.,,,,,1,
"Therefore, authors as [86], propose the replacement of the initial distribution unicast using broadcast-based techniques.",,,,,1,
"The authors of [87] propose the use of a certificate called TESLA, which can be use by low capacity devices (such as WSN nodes) to provide entity authentication.",,,,,1,
A certificate of a legitimate user (U) is signed by the CA.,,,,,0,
However it may cause a bottleneck process from the sensor nodes if there is excessive traffic on the network.,,,,,1,
"What is new in this mechanism is to provide a key distribution combinatorial and deterministic, providing authentication is implemented as a security component of TinyOS.",,,,,1,
This mechanism based on multiple MAC messages and requires that network nodes have a key ring.,,,,,1,
"To authenticate a message, the source node generate a list of MAC based on their keys, and added them to the message.",,,,,0,
To meet the WSN restrictions must be designing an appropriate key ring.,,,,,0,
Task 2.4 aims at providing savvy users the means to assemble and program hardware that can be used by end-users to customize their smart environment.,,,,,1,
This section will provide a brief survey on the existing Do-it-Yourself hardware platforms and identify the technical challenges that need to be addressed to simplify the exposure of DiY devices in the DiYSE platform.,,,,,0,
It features a number of analog inputs and outputs to which different kinds of low cost sensors and actuators can easily be plugged.,,,,,0,
"It can easily be programmed using Wiring, a simple programming language, and the associated Arduino IDE.",,,,,0,
"Arduino features add-on modules called “shields”, which allow to add preassembled circuits to the main board to control motors, add Ethernet, Bluetooth, ZigBee, etc.",,,,,1,
"The drawback is that in order to operate the device, the computer needs to be running.",,,,,1,
"Networked device: Arduino boards can participate in a network, either using Ethernet or ZigBee shields with the corresponding libraries.",,,,,0,
"In this set up, different Arduino-based devices can talk to each other, to computers in the LAN or even to servers on the Internet (a gateway is still required for ZigBee to IP bridging).",,,,,0,
This is the most interesting configuration for DiYSE as it enables interaction between the application creation environment and the devices.,,,,,1,
A huge number of embedded devices today run *NIX-like operating systems such as GNU/Linux and are open or hacked so that they can run custom software.,,,,,1,
"Indeed, peripherals such as Phidgets can be attached thus turning them into IP ambient devices that can be placed in buildings, vehicles or outdoor, powered by AC, batteries or even solar panels.",,,,,1,
This section will focus on how to easily connect self-programmed or self-assembled devices to a common infrastructure so that they can be accessed from the DiYSE application creation environment.,,,,,1,
Non-networked devices or devices that communicate with each other without interacting with computers or IP networks at all (e.g. a WiiMote controlling an Arduino-based Bluetooth lamp) are out of the scope of the DiYSE project because of the lack of obvious means to link them to the DiYSE application creation environment.,,,,,1,
"In general, IP devices host servers exposing their built-in functions, either through TCP or UDP servers, HTTP servers (possibly using a RESTful resource model [11]), UPnP [12] or DPWS [13].",,,,,0,
"In that case, user-added functions should also be exposed as services in the network.",,,,,1,
"As IP devices, they can directly participate in network interactions without intermediaries, either on the local network or through the Internet.",,,,,1,
UPnP and DPWS protocol stacks fully match the needs of plug-and-play IP devices and open-source tools enable the development of the service software for many embedded platforms.,,,,,1,
"However, the required effort make it more suited for industrial companies than for hobbyists.",,,,,0,
"Using an HTTP server (preferably using a RESTful resource model) is a good compromise, as HTTP servers are available in binary format for all kinds of IP devices and programming can be simply done through server-side scripts.",,,,,1,
"Description: in addition to discovery, the protocol enabling to control the device should be described or the software component enabling its usage (driver) made available in order to avoid users manually describing the interaction protocol.",,,,,1,
"Eventing: if devices are meant to receive commands and notify events, a callback mechanism should be implemented.",,,,,1,
"Assuming that the semantics and coordination of the device interaction is ensured by the upper layers, the remaining challenge for a Do-it-Yourself usage of this category of devices is the seamless search and deployment of the appropriate device drivers.",,,,,0,
"In order to achieve a sense of interaction without computers, these peripherals can be connected to the one of the abovementioned embedded GNU/Linux-based computers, which can run permanently, silently and hidden.",,,,,1,
"In this case, a network service exposing the peripheral to remote user applications would be required.",,,,,1,
This category groups devices that communicate using networks that do not use full TCP/IP stacks.,,,,,1,
"As an example, an increasing number of hobbyists that want wireless battery-powered devices buy ready-to-use ZigBee modules [14].",,,,,0,
These modules are easy to use as they behave like simple modems (communication uses serial and configuration is done through Hayes AT commands).,,,,,1,
"Having a computer (“gateway”) run a program that controls the whole network, hides its underlying complexity and exposes it as a service or “virtual device”.",,,,,0,
"The advantage is the solution is simple to implement, as it is equivalent to exposing a peripheral.",,,,,1,
"In this case, the role of the gateway is solely to compress and uncompress the IPv6 headers.",,,,,1,
"The remaining issue is that running a TCP stack on such low-power devices, even if feasible, is over-engineering for its actual usage.",,,,,1,
"This document, the EIRENE Functional Requirements Specification version 7.1, is an interim version released to address some known issues and errors in the specification and to ensure consistency with the EIRENE System Requirements Specification.",,,,,1,
"In case of any inconsistencies relating to EDOR, the EIRENE Functional Requirements Specification version 7.1 takes precedence over the EIRENE System Requirements Specification.",,,,,1,
"No part of this publication may be copied, reproduced or distributed by any means whatsoever, including electronic, except for private and individual use, without the express permission of the International Union of Railways (UIC).",,,,,1,
"The same applies for translation, adaptation or transformation, arrangement or reproduction by any method or procedure whatsoever.",,,,,0,
"Only the initiator of the call may talk, with all other group members listening only.",,,,,1,
The coach number may form a component of a functional number used to address users/systems on an item of rolling stock.,,,,,0,
The engine number may form a component of a functional number used to address users/systems on an item of traction stock.,,,,,1,
Statements within the fiche may comprise specifications which are binding on UIC members (‘obligatory’ specifications) or optional (‘recommended’ specifications).,,,,,0,
The full number used within the functional addressing scheme to identify an end user/system by function or role rather than by a specific item of radio equipment or user subscription.,,,,,0,
"Only one member of the group may talk at any instant, with all other group members listening only.",,,,,1,
"High priority calls (critical group calls for drivers in the same area initiated by a driver, critical group calls for station and security staff, trackside maintenance staff or controller groups) are made in exceptional circumstances where the situation requires a higher level of priority than for normal operational calls, but the same call handling regarding alerting and setup.",,,,,0,
A form of unidirectional signalling transmitted periodically or constantly from one radio to another to allow the receiving user to detect a break in radio transmission during critical manoeuvres (eg during shunting).,,,,,1,
An open interface is an interface complying with published standards.,,,,,0,
"A call of highest priority for informing drivers, controllers and other concerned personnel of a level of danger requiring all Railways movements in a pre-defined area to stop.",,,,,0,
Secondary Controllers require the facility to communicate with trains in all situations in order to perform their function.,,,,,1,
A radio is considered in “Shunting Mode” when it is prepared to receive shunting emergency calls but cannot receive train emergency calls.,,,,,1,
A group of people manoeuvring trains in order to change their location or composition.,,,,,1,
Communications for shunting are particularly critical when a driver at the front of a train is pushing it backwards towards buffers or other potential obstructions.,,,,,1,
In this case a lookout is often required to report progress to the driver.,,,,,1,
A radio is considered in “Train Mode” when it is prepared to receive train emergency calls but cannot receive shunting emergency calls.,,,,,1,
A train number may form a component of a functional number used to address users/systems on a train.,,,,,1,
"The EIRENE Functional Requirements Specification defines a set of requirements which a railway radio system should comply with, in order to facilitate international interoperability between national railways and manufacturing economies of scale.",,,,,1,
"This specification therefore defines the functional requirements, to ensure that core railway functionality is provided.",,,,,1,
It is mandatory that each railway meets these specifications on lines where interoperability is required.,,,,,1,
"Optional requirements are not mandatory for interoperability and, as such, the selection (or non-selection) of a set of optional requirements on a national basis shall not be used as a precondition for the certification and the acceptance of roaming mobile equipment on GSM-R networks.",,,,,1,
"When an option is selected, the method defined in the SRS and FRS by which such features are implemented becomes mandatory, both to provide a consistent service and to present a recognised and agreed standard to manufacturers in order to obtain economies of scale in development and manufacture.",,,,,1,
Such point-to-point calls shall allow both parties to talk simultaneously.,,,,,1,
The system shall allow a user to make public emergency point-to-point voice calls.,,,,,1,
It shall be possible for controllers to speak at any time during the call.,,,,,0,
"It should be possible for the network to prevent the identity of certain users from being displayed on the mobile, either when being called, calling or both.",,,,,1,
Any user who is not within the list of allowed EIRENE users shall not be able to gain access to any of the functions and services provided by the network.,,,,,0,
It shall be possible for an incoming call or data message for one user to be forwarded to another user using functionality provided by the network.,,,,,0,
"In the case of voice calls, it shall be possible for the user who is attempting to forward a call to converse with the intended recipient prior to forwarding.",,,,,0,
It shall be possible for the user to re-join the call which is on hold at any time.,,,,,0,
It may be necessary to supplement this Functional Requirements Specification with special requirements for supporting the train control application.,,,,,1,
The level of coverage should be at least 95% of the time over 95% of the designated coverage area for a radio installed in a vehicle with an external antenna.,,,,,0,
Operational radios – for use by railway personnel involved in operations such as trackside maintenance.,,,,,0,
Shunting radio - for use by railway personnel involved in train operations such as shunting.,,,,,0,
ETCS data only radios - for the transmission of train control data.,,,,,0,
Any environmental and physical requirements stated may be superseded by national requirements if the national standards provide a higher level of environmental and physical protection.,,,,,1,
It shall be possible for the driver to initiate a call to any of the following types of controller with a minimum of driver action being required (eg a single keystroke): (M) - power supply controller.,,,,,0,
"If the radio system cannot give a unique identity for a given type of controller, the identity could be obtained using external systems as defined in 11.4.7.",,,,,1,
"If the system is not able to connect the call, an audible and visual indication shall be provided to the driver that the call was not received by the controller.",,,,,1,
This shall also indicate if the called party was busy or if the network could not connect the call.,,,,,1,
"In the latter case, the controller is automatically added into the multi- driver call.",,,,,1,
"Not more than 2 MMI actions should be necessary to switch between groups, i.e. to leave one group and to subscribe to another group, excluding the operations necessary to select the required group from a list or enter digits.",,,,,0,
The design of the equipment shall make it possible to install it within a cab complying with the requirements of UIC fiche 651 concerning the layout of cab equipment5.,,,,,0,
A driver safety device (DSD) interface should be provided in traction units that are equipped with a DSD in order to support the transmission of a DSD alarm.,,,,,1,
Additional information may also be provided if available from external systems.,,,,,1,
It shall not be possible for any General purpose radio user to send a Railway emergency call by dialling a short code or telephone number.,,,,,1,
The user may then talk whilst the PTT function is used.,,,,,1,
Changing the battery should not result in losing data stored in the radio.,,,,,1,
"If the ability to initiate Railway emergency calls is implemented in the radio, accidental initiation of a Railway emergency call shall be prevented.",,,,,1,
The Operational radio should have a carry feature that allows the operator to instantly have both hands free without dropping the radio.,,,,,1,
It shall be possible to change the battery without losing data stored in the radio.,,,,,0,
"This common terminal platform should have interfaces, applications and accessories to fulfil specific national railway needs.",,,,,0,
"For activation, a maximum of 2 MMI actions should be allowed.",,,,,1,
"At the detailed level, different controllers may have specific addressing needs, eg catering controllers will need to call specific vehicles in a train.",,,,,1,
International standardisation of numbering plans is needed to ensure interworking between networks.,,,,,1,
"Furthermore, standardised allocation of numbers to subscribers will facilitate schemes for identification, barring, etc.",,,,,0,
"Telephone numbers can be defined on a national basis, but codes for certain functions shall be used on an international basis in order to allow interoperability.",,,,,1,
"For certain functions, standardised telephone numbers shall be implemented.",,,,,1,
"To provide interoperability between the fixed railway networks within the EIRENE network, standardisation of UIC group numbering will be required.",,,,,1,
"In the case where an EIRENE mobile attempts to make a Railway emergency call over a public network, the ability to pre-empt lower priority calls (particularly public emergency calls) may be inhibited, unless a special agreement is in place.",,,,,1,
"If required, a railway may make additional restrictions to the access matrix.",,,,,1,
"During this recovery period, the system shall not permit the use of unverified functional numbers.",,,,,1,
"If the mobile is in shunting mode, the emergency call button shall initiate a shunting emergency call, otherwise the call shall be a Train emergency call.",,,,,1,
"The predefined areas for emergency calls shall include, where necessary, parts of one or more network(s).",,,,,1,
This facility is required principally for the safe conduct of pushing manoeuvres to assure continuing availability of the radio channel while a shunting worker is guiding a train driver.,,,,,1,
"This document also represents a guide for the developing process, because it informs about the priority of the tasks, the dependencies among the tasks and the information they require, including the background, objectives, and targets too.",,,,,1,
"In the process of the requirements definition, we can use different approaches depending on the software methodology.",,,,,1,
