Sentence,jfr,jannik,MaxK,student1,student2,arjen
Austenitic stainless steels are susceptible to pitting corrosion and crevice corrosion in a marine environment; some austenitic stainless steels are susceptible to SCC in a marine environment.,0,,,,,
UNS N08367 (trade name AL-6XN) or UNS S31254 (trade name 254 SMO) shall be used in pressure piping and tubing in lieu of 300-series stainless steel when the piping or tubing is directly exposed to a corrosive environment.,1,,,,,
Hardware should be designed to avoid fretting or wear of stainless-steel alloys.,0,,,,,
Lubricants and lubricated coatings should be considered for use with stainless-steel materials in applications where they come into contact through a sliding movement.,1,,,,,
Stainless-steel alloys (such as Nitronic 60) that resist galling should be considered as alternatives.,0,,,,,
"Alloys in the 5000-series containing more than 3% magnesium shall not be used in applications where the temperature exceeds 66 °C (150 °F), because grain boundary precipitation above this temperature can create stress-corrosion sensitivity.",1,,,,,
Hardware made with aluminum alloys should not be loaded through the short transverse grain direction because resistance to SCC is at a minimum in that direction.,1,,,,,
"Alloys with high nickel content are susceptible to sulfur embrittlement; therefore, any foreign material that could contain sulfur, such as oils, grease, and cutting lubricants, shall be removed before heat treatment, welding, or high-temperature service.",1,,,,,
"Some of the precipitation-hardening superalloys are susceptible to depletion of the alloying element at the surface in a high-temperature, oxidizing environment.",0,,,,,
"This effect should be carefully evaluated when a thin sheet is used, since a slight depletion could involve a considerable proportion of the cross section of the material.",1,,,,,
"Fretting may cause cracking, potentially leading to fatigue failure.",1,,,,,
Titanium alloys shall not be used with LO2 or GO2 at any pressure or with air at oxygen partial pressures above 35 kPa (5 psia).,0,,,,,
"The surfaces of titanium and titanium alloy mill products shall be 100% machined, chemically milled, or pickled to a sufficient depth to remove all oxygen-contaminated layers (alpha case) formed as a result of mill processing, heat treating, and forming operations at elevated temperatures.",0,,,,,
All cleaning fluids and other chemicals used during manufacturing and processing of titanium hardware shall be verified to be compatible with and not detrimental to the material’s performance.,0,,,,,
"The use of titanium in hydrochloric acid, chlorinated solvents, chlorinated cutting fluids, fluorinated hydrocarbons, and anhydrous methyl alcohol should be avoided due to titanium’s susceptibility to SCC.",1,,,,,
"Contact of titanium alloys with mercury, cadmium, silver, and gold should be avoided at certain temperature ranges because of liquid-metal-induced embrittlement and/or solid-metal-induced embrittlement.",1,,,,,
"Copper alloys, brasses, and bronzes that are resistant to general corrosion and pitting, and highly resistant to SCC in accordance with MSFC-STD-3029 shall be used in GS.",0,,,,,
GS should be designed so that copper is not exposed to hydrazine environments.,0,,,,,
"Copper has the potential for SCC when exposed to ammonia, which is a product of hydrazine decomposition.",1,,,,,
"Beryllium copper (UNS C17200) is commonly used for high-strength, nonsparking structural components in applications where it is subject to contact and wear.",1,,,,,
"Beryllium particles, beryllium oxide, and other beryllium compounds are toxic when inhaled.",1,,,,,
Extreme caution must be exercised during fabrication to avoid exposing personnel to beryllium or beryllium compounds.,1,,,,,
Tin solder and tin plating shall be alloyed with at least 3% lead to prevent the growth of tin whiskers.,0,,,,,
"For critical GS, lot sampling shall be used to verify the presence of at least 3% lead.",0,,,,,
Elastomers shall not have a corrosive effect on other materials when exposed to conditions normally encountered in service.,1,,,,,
Examples include one-part silicones that liberate acetic acid when they are cured.,1,,,,,
"NASA-TM-86556, Parts A and B, should be used in evaluating and selecting solid and liquid lubricants for GS.",0,,,,,
Long-life performance should be considered when selecting lubricants.,1,,,,,
Use of lubricants near precision-cleaned hardware or electrical connections should be minimized or tightly controlled to prevent cross-contamination.,0,,,,,
Lubricants containing chloro-fluoro compounds shall not be used with aluminum or magnesium.,0,,,,,
Lubricants containing chloro-fluoro compounds shall not be heated above their maximum temperature rating.,0,,,,,
The decomposition/reaction products that result from overheating lubricants that contain chloro- fluoro compounds can attack metallic materials and can be toxic.,1,,,,,
Materials that are not expected to meet the design life requirements but must be used for functional reasons shall be identified as limited-life items in accordance with 4.2.2.2.,0,,,,,
Materials should be selected to meet the useful life of the hardware without the need for additional maintenance.,0,,,,,
"Though MSFC-STD-156 is not current, it does contain the best practices for riveting.",1,,,,,
"The selection of parent materials and weld methods for GSE should be based on consideration of the weldments, including adjacent heat-affected zones, as they affect the operational capability of the parts concerned.",1,,,,,
"Welding procedures should be selected to provide a weld of the required quality, use the minimum amount of energy, and protect the heated metal from contamination.",0,,,,,
"A WPS is always required, even if the procedure is considered to be prequalified by an applicable AWS standard.",1,,,,,
"Prior to the start of any production welding, all WPSs and procedure qualification records (PQRs) shall be approved by an M&P engineer authorized by NASA.",1,,,,,
"Prior to the start of production welding, each welder and welding operator shall be qualified.",1,,,,,
"Prior to the start of any production welding, all welder/welding operator performance qualification (WPQ) shall be approved by an M&P engineer authorized by NASA.",1,,,,,
"Subsequent fusion welding operations in the vicinity of brazed joints or other operations involving high temperatures that might affect the brazed joint shall be prohibited unless it can be demonstrated that the fixturing, processes, methods, and/or procedures employed will preclude degradation of the brazed joint.",1,,,,,
"For furnace brazing of complex configurations, such as heat exchangers and cold plates, destructive testing shall be conducted on preproduction brazed joints to verify that the brazed layer that extends beyond the fillet area is continuous and forms a uniform phase.",0,,,,,
Soldering of electrical connections not exposed to vibration or thermal cycling shall be in accordance IPC J-STD-001.,0,,,,,
Soldering of electrical connections exposed to vibration or thermal cycling shall be performed in accordance with IPC J-STD-001ES.,0,,,,,
"For critical GS, lot sampling shall be used to verify the lead content.",0,,,,,
Steel parts shall be heat-treated to meet the requirements of SAE AMS-H-6875 or SAE AMS 2759.,0,,,,,
"Nickel and aluminum form a strong galvanic cell at the nickel-aluminum interface, and exposure of the aluminum alloy to a corrosive environment can rapidly debond the nickel plate.",0,,,,,
"For critical GS, after the forging technique (including degree of working) is established, the first production forging shall be sectioned to show the grain-flow patterns and to verify mechanical properties.",0,,,,,
The procedure shall be repeated after any change in the forging technique.,1,,,,,
"Forging techniques should produce an internal grain-flow pattern parallel to the principal stresses, because mechanical properties are optimum in the direction of material flow during forging.",1,,,,,
Retesting of adhesives used for production parts is not required if they are within the manufacturer’s recommended shelf life.,1,,,,,
"In the absence of relevant performance data, bond sensitivity studies should be conducted to verify that the required adhesive properties are maintained after exposure to the expected materials at the expected concentrations, including ozone, ambient humidity, cleaning fluids, and lubricants.",1,,,,,
Adequate cleanliness inspections should be conducted during the fabrication part of the bonding process.,1,,,,,
Bonded primary structural joints shall demonstrate cohesive failure modes in shear at ambient temperature.,0,,,,,
"For GS interfaces with precision-cleaned fluid systems for flight, the supply interface/final filters shall be located as close to the flight hardware interface as possible.",0,,,,,
"Interface filters shall be used on outlet lines if it is determined that any operations, such as the servicing or deservicing of fluids, could permit flow in a reverse direction.",1,,,,,
Interfacing fluid system GS shall be cleaned to meet or exceed the cleanliness level of the flight hardware.,0,,,,,
Other precision cleaning standards may be used if determined equivalent by an M&P engineer approved by NASA.,1,,,,,
"Electrical cables shall be designed and fabricated in accordance with KSC-GP-864 as determined by application, criticality, and operational environment.",0,,,,,
"Where electronic circuitry can be damaged or degraded by moisture, dust, chemicals, temperature extremes, mechanical stress, or vibration, conformal coating shall be required in accordance with NASA-STD-8739.1.",1,,,,,
"When established, requirements for conformal coating should be stated in the design documentation.",1,,,,,
"For critical GS, faying surfaces of metal alloys and electrical bonding connections, except for nickel-plated surfaces, shall be sealed in accordance with NASA-STD-5008, except for nickel-plated surfaces.",0,,,,,
"In critical applications, metals exposed to the KSC environment shall be selected from alloys that are highly resistant to SCC as specified in MSFC-STD-3029.",0,,,,,
"In noncritical applications, the designer should select from alloys that are highly resistant to SCC as specified in MSFC-STD-3029.",0,,,,,
"When COTS items are selected, the designer should attempt to identify the materials used and determine if an SCC failure would be critical.",1,,,,,
The M&P authority’s signature or electronic approval of the design drawings constitutes approval to use the materials of the design in the intended application.,0,,,,,
"The entrained hydrogen reduces the ductility of the metal and load-bearing capacity, resulting in brittle fracture at stresses below the yield stress of susceptible materials.",0,,,,,
Hydrogen can also be introduced as a by-product of a corrosion reaction in which some of the hydrogen enters the metal in atomic form.,0,,,,,
Test data may have to be generated in a simulated environment to support the approval rationale.,0,,,,,
"After electroplating, phosphating, pickling, passivation, or other processes that can introduce hydrogen, materials that are susceptible to hydrogen embrittlement shall undergo a final baking heat treatment in accordance with SAE AMS 2759/9.",1,,,,,
Corrosion protection shall be in accordance with NASA-STD-5008 to minimize the risk of hydrogen embrittlement due to corrosion.,0,,,,,
The GS provider is responsible for submitting documentation to verify that the hardware/software has been developed in accordance with this standard.,0,,,,,
"The GS provider is responsible for providing all the necessary documentation to the using organization when the GS is delivered for use, regardless of who “owns” the GS at the time of delivery.",1,,,,,
"The using organization requires documentation for safely operating, maintaining, and servicing the GS.",1,,,,,
"To reduce risk to the mission, as well as to ground personnel and flight crews, a Failure Modes and Effects Analysis should be completed and submitted in accordance with the criticality assigned to the GS by the responsible program or project.",0,,,,,
Comments submitted on this form do not constitute or imply authorization to waive any portion of the referenced document or to amend contractual requirements.,1,,,,,
"NATURE OF CHANGE (Identify paragraph number and include proposed rewrite, if possible.",1,,,,,
"Respondents should be aware that notwithstanding any other provision of law, no person shall be subject to any penalty for failing to comply with a collection of information if it does not display a currently valid OMB control number.",1,,,,,
"Various IoT platforms are emerging on the market to manage these networks and deliver new business models and services Nevertheless, these data-providing infrastructures are currently acting as isolated islands in the global IoT landscape.",0,,,,,
"Interconnection of these islands might bring significant added value driving IoT market development, but exploitation of these benefits is inhibited by various interoperability barriers that are present in the current IoT ecosystems.",0,,,,,
This document is prepared as a starting point for business audience to understand the basic concepts of the VICINITY solution.,,0,,,,
"Interoperability is a key element, and ensures cooperation between the different domains.",,1,,,,
It is in this context that VICINITY may bridge the gap between domains by placing the ontology outside the physical domain (see task 2.1).,,1,,,,
"All business requirements for each vertical domain as described in section 4.1, 4.2, 4.3 and 4.4, are consolidated and sorted.",,1,,,,
"On the other hand, the model is used during WP6 to check and validate these inputs.",,1,,,,
"If some proposed requirements cannot be met, either the architectural design or the requirements themselves need to be changed as previously described in section 3.1.",,1,,,,
"The same happens if during the lifetime of the VICINITY projects, some of the requirements will change.",,1,,,,
"Not only does this allow validating that all requirements are met, but also which of them may cause or are subject to threats and risk and thus need to be handled with special care.",,1,,,,
Each pilot has one or more domain focus - and hence differentiated business requirements.,,1,,,,
Common assets in a neighbourhood need to be understood in order to identify the value of the assets.,,1,,,,
"When capacity is high and need is low, the price for sharing is normally low.",,1,,,,
"When capacity is low and need is high, the prices for sharing will be high.",,1,,,,
"However, a lack of visualisation of consumption of resources and lack of accountability prevents these savings to be made.",,1,,,,
"IoT gives the property-owner a high-resolution multichannel information-window, making possible to optimise the use of considerable resources inside the building as well as between buildings (cross assets) within a neighbourhood both virtually and physically.",,1,,,,
"As grids reach maximum use capacity or reach its exploitation limit, the importance of load management increases.",,1,,,,
"To be able to trade between buildings and grid owners, working markets with load pricing, as well as load shedding and shifting prices must be in place.",,1,,,,
"Facility managers and grid owners should support to interoperability between various IoT assets (i.e. load flexibility and constraints) that are needed for load management across various building (e.g. devices, charging station) and energy assets (such as RES, batteries,), to be able to trade loads in practice.",,1,,,,
A communication flexibility and information architecture that can handle the speed and heterogeneity of current and future technical developments is needed.,,1,,,,
"Facility owners, tenants, building managers should be supported in measurement and visualisation of the interior conditions and parameters to understand the resources consumption and their effects on wellbeing.",,1,,,,
"The facility owner, tenants and building managers should be supported in measurement the resource usage and / or occupancy to optimise resource maintenance or identify situations required manual or automatic intervention.",,1,,,,
The service providers should have access to devices utilisations to be able to customise the device operation and maintenance leading towards “appliances as a service model”.,,1,,,,
"The facility owners, managers and tenants should have access to information of activities and resource consumption in order to identify and optimise the buildings operative parameters.",,1,,,,
"The facility owners, managers and tenants should have access to an overview of registered activities and resource consumption, in order to identify areas in actual need of cleaning, thus reduce the energy consumption and minimise the wear on other parts of the building.",,1,,,,
Increasing interoperability in consolidating this information is expected to create positive synergies.,,1,,,,
"Consumers with a B2C relationship will need “a system which should learn the user's preferences and optimize automatically without the need of user interaction.” To achieve this, hybrid fully- automated systems enabled by IoT solutions should be designed, demonstrated and tested.",,1,,,,
"Ownership of data and information about ownership, access, and other related information about the device, should be made available for improved data management and transparency when installed.",,1,,,,
"This also increases energy efficiency, because with advice the users might achieve a better rational use of energy, benchmark designed performance and actual performance of systems.",,1,,,,
"The facility owners and managers should be supported in monitoring of energy production/ consumption and facility resource occupancy and/or utilization and heat production over various devices in order to be able to improve the understanding of production, consumption and utilization and provide an opportunity to optimize billing for renters.",,1,,,,
"The facility owners, managers and tenants should be supported to measure, cluster and visualise of the energy and water consumption of devices to provide an opportunity to do assessment of alternative models of management reduce resource consumption and systems substitution decision making.",,1,,,,
The data owners should be supported to share available weather data to energy producers from scientific equipment providing them an opportunity to optimise their renewable energy production.,,1,,,,
"EV charging enabled parking place may be booked by facility owners, thus offering the ability to manage energy production and consumption (demand-response) as well as EV charging utilization to facility owners and/or managers, to identify smooth positive and negative peaks in the electrical energy consumption of buildings taking into account energy price, parking place occupancy plan and price.",,1,,,,
The household owners should be supported with information on resource consumptions and demand response services providing them opportunity to improve energy efficiency of their households and/or improve usage of excess renewable energy.,,1,,,,
"Plans for solar panel cleaning based on condition of soiling as opposed to periodic cleaning, could be offered by solar panel operators in order to improve panels’ quality of service and reduce costs for cleaning.",,1,,,,
Sharing more data via VICINITY would increase the visibility of processes and enhance data quality resulting in better quality of services which might lead to higher financial returns in a medium to long term period.,,1,,,,
"A lack of internal resources, lack of commitment from the management, and regulatory compliance issues complicates this further, such that data protection and security by design will be a key driver.",,1,,,,
"Integration with other transport related sectors – most notably car sharing and public transport should also be supported in order to establish the foundation for a healthy ecosystem, and also alleviate some of the pressure on the infrastructure, thereby reducing the climate footprint.",,1,,,,
Other reader/detection units might be integrated when deemed necessary.,,1,,,,
Certain disabilities and lack of previous experience might affect the usability aspect.,,1,,,,
This is even more important when the mobile devices will offer interaction with 3rd party services that will be built on top of the parking experience.,,1,,,,
"Access to and visualisation of structural plans/layout for garage facilities should be included in the information about access points, charging stations, fire extinguishers, escape exists, alarm signals as this is necessary in order to provide a proper service that can be implemented and expanded on a longer term.",,1,,,,
"Therefore, Interoperability on these areas including other value added services should be supported.",,1,,,,
"Standardisation of DATEX II establish a basis for common exchange between the traffic and the travel information sector, thus opening for cross-domain value-added services.",,1,,,,
These data can also be when correlated with data from ALR-detection and hence improve parking services processes.,,1,,,,
"In order for the demonstrations to be tested appropriately and effectively, a set of specific business requirements should be defined and followed.",,1,,,,
"Therefore, a business requirements framework is necessary for the case.",,1,,,,
"Therefore, as the demonstrations run in municipality level, the participating municipality should ensure the involvement of the necessary healthcare personnel.",,1,,,,
"Complex, inefficient devices might lead users to reduce their level of participation or even completely abandon them.",,1,,,,
"As authorised third parties will have access to user’s personal data – especially in case of emergency, the user should have a fully-detailed, complete picture of who and when accessed his/her data.",,1,,,,
"Therefore, an effective audit management mechanism should be introduced.",,1,,,,
"Therefore, contracts defining ownership of data, usage of data and privacy should be introduced.",,1,,,,
"Therefore, a common interoperability “language” should be defined in order to overcome linguistic barriers that could lead to possible misconceptions.",,1,,,,
Caretaker should have access to smart drug dispense usage statistics to be able to detect abnormal drug usages.,,1,,,,
Simple wearable devices should be supported for elderly people when their ability to operate smart phones or other technical equipment are limited.,,1,,,,
Household appliances usage data could be offered to healthcare providers in order to identify abnormal behaviour in elderly citizens’ households.,,1,,,,
"Weather data from scientific equipment to municipalities could be shared by providers, hence municipalities may recommend maximum time of sun exposure to citizens.",,1,,,,
Elderly people expect use simple and affordable wearable devices while their ability to operate smart phones are limited.,,1,,,,
The ontologies should be extensible to provide semantic interoperability for new devices.,,1,,,,
The unsolicited access or operations in high-volumes can cause unavailability of the part or whole system.,,1,,,,
Each of these security threats needs to be addressed by one or several security measures to minimize the security risk to acceptable level.,,1,,,,
"In order to collect and analyse business drivers and barriers in the context of IoT interoperability, a survey was conducted using a questionnaire to interact with stakeholders and visit to the pilot sites demonstration VICINITY solution.",,1,,,,
"In many case the owners of these data sources are unwilling to share access to their data, especially if they do not have a business case, which enables them to benefit directly from the new services derived from their data.",,1,,,,
"At this stage of project development VICINITY system´s perceived strengths by the stakeholders in general are as follows: “Interoperability and integration of various standards and protocols which would allow for broad use of the product, allowing for rapid innovation”.",,1,,,,
The approach and philosophy employed by VICINITY takes into consideration stakeholders’ opinions in order to build solutions focused on meeting their requirements whilst tackling issues they have identified.,,1,,,,
"Further deliverables in Work Package 1, such as D1.5 and D1.6, will identify functional and technical requirements, resulting in a system architecture, thus completing the knowledge base upon which the VICINITY solution will be developed, tested, deployed and demonstrated.",,1,,,,
"Describe the overall strategy for the organization level decisions on common bases for multiple project portfolio – when multiple system projects are running or planned to pursue the same business goal, the priority, relative positioning, and possible constraints come from the portfolio management strategy.",,1,,,,
An unsteady state of business operation includes a manual operation mode when the proposed system is not available due to some unexpected situation like an accident or natural disaster.,,1,,,,
"Different uses have different needs, either because of the vehicles, or because of disabilities or other concerns with the passengers/drivers/owners.",,1,,,,
"Cost efficiency is an issue, and introducing parking space sharing, as it makes it possible to ensure that neither private nor public parking sites are left with unused space.",,1,,,,
"By allowing people to receive relevant data, the user is enabled to make more choices that are informed.",,1,,,,
"This provides them the option of deciding how to ride, when and where to ride.",,1,,,,
"It opens for integration from different domains, and facilitates efficient movement of goods and people, thus ensuring logistics supporting the city.",,1,,,,
